Trip ID,Destination,Trip Name,Description,Trip Category,Duration,Price Adult,Price Child,Included in Price,Not Included,Start Date,End Date,Available Spots,Tour Guide,Group Size,Meeting Point,Departure Time,Return Time,Rating,Reviews Count,Photo URL,Contact Email,Contact Phone,What to Bring,Trip Difficulty,Languages Available,Age Restrictions,Transportation Type,Meals Included,Cancellation Policy,Accessibility,Special Offers,Trip Schedule
TRIP001,Sharm El Sheikh,Dolphin Show,"What an incredible adventure that must be! Sharm El Sheikh is a paradise on its own, but throwing dolphins into the mix takes it to a whole new level of awesomeness. Imagine the thrill of swimming alongside these playful creatures—it’s the stuff dreams are made of! It’s one of those bucket-list moments you’ll treasure forever. So, have you already made a splash with them, or is this an exciting plan in the works?","Family, Couples, Indeviduals,Group",7 Hours,20,10,"Transportation, Guide, Equipment, Meals","Drinks, Shoping, Guide Tips,",4/1/2025,1/1/2030,20,John Doe - Licensed Egyptologist,10-20 people,Hotel Lobby,02:30 p.m,04:30 p.m,4.7/5,35,Picture,info@egypttrips.com,+20 123 456 789,"towel,suncream, Cash, Walking shose",Moderate,"English, French, German, Arabic, Russian., Polish,",2-70 Year Old,"Bus, Van, Boat","Lunch, Snacks",Free cancellation within 24 hours,Wheelchair accessible,10% off for groups of 4 or more,Every Day
TRIP002,Sharm El Sheikh,Ras Mohammed National Park Tour & Maldives White Island,"Ras Mohammed National Park is an absolute gem for anyone who loves the underwater world! Picture yourself gliding through vibrant coral gardens, surrounded by an explosion of marine colors and creatures—it’s like stepping into a living postcard. And with waters so clear, it’s almost as if nature rolled out a VIP welcome mat just for you. Whether you've already been lucky enough to explore its wonders or you're gearing up to add it to your bucket list, it’s definitely a slice of paradise worth diving into!","Family, Couples, Indeviduals,Group",8 Hours,25,15,"Transportation, Guide, Entrance Fees, Meals","Drinks, Shoping, Guide Tips,",4/1/2025,1/1/2030,20,John Doe - Licensed Egyptologist,10-20 people,Hotel Lobby,08:00 a.m,05:00 p.m,4.5/11,61,Picture,info@egypttrips.com,+20 123 456 789,"towel,suncream, Cash, Walking shose",Easy,"English, French, German, Arabic, Russian., Polish,",2-70 Year Old,"Bus, Van, Boat","Lunch, Snacks",Free cancellation within 24 hours,Wheelchair accessible,10% off for groups of 4 or more,Every Day
TRIP003,Sharm El Sheikh,Ras Mohamed Magic Lake by Bus,What an incredible day that sounds like! Starting off with a comfortable guided bus tour to Ras Mohammed sets the perfect tone for an adventure. Then diving into those crystal-clear waters to explore legendary reefs like Shark and Yolanda—what a feast for the eyes! And finishing the day with some relaxation on the beach and a delicious lunch? That’s the kind of experience that leaves lasting memories. A true escape into natural beauty and tranquility.,,6 Hours,20,10,"Transportation, Guide, Equipment, Meals","Drinks, Shoping, Guide Tips,",4/1/2025,1/1/2030,20,John Doe - Licensed Egyptologist,10-20 people,Hotel Lobby,09:00 a.m,03:00 p.m,4.7/18,88,Picture,info@egypttrips.com,+20 123 456 789,"towel,suncream, Cash, Walking shose",Moderate,"English, French, German, Arabic, Russian., Polish,",2-70 Year Old,"Bus, Van, Boat","Lunch, Snacks",Free cancellation within 24 hours,Wheelchair accessible,10% off for groups of 4 or more,Every Day
TRIP004,Sharm El Sheikh,Intro Dive Ras Mohamed,"What an extraordinary escapade that promises to be! Having a professional PADI diver lead you through the breathtaking underwater world of the Red Sea is like having a personal gateway to paradise. Picture yourself gliding alongside vibrant coral formations and mingling with the fascinating array of marine life. Add the crystal-clear waters to the mix, and it becomes the kind of adventure that stays etched in your memory forever. Truly, an experience like no other.","Family, Couples, Indeviduals,Group",Half Day,35,35,"Transportation, Guide, Entrance Fees, Meals","Drinks, Shoping, Guide Tips,",4/1/2025,1/1/2030,20,John Doe - Licensed Egyptologist,10-20 people,Hotel Lobby,08:00 a.m,04:30 p.m,4.5/18,89,Picture,info@egypttrips.com,+20 123 456 789,"towel,suncream, Cash, Walking shose",Easy,"English, French, German, Arabic, Russian., Polish,",2-70 Year Old,"Bus, Van, Boat","Lunch, Snacks",Free cancellation within 24 hours,Wheelchair accessible,10% off for groups of 4 or more,Every Day
TRIP005,Sharm El Sheikh,Scuba Diving Adventure,"Diving in Ras Mohammed National Park is truly a world-class experience! With its remarkable underwater landscapes, teeming marine life, and pristine coral reefs, it’s a destination that captivates both beginners and seasoned divers alike. Whether it’s your first dive or your hundredth, the park’s underwater wonders have an unmatched ability to leave you in awe. It’s the kind of adventure that redefines what it means to explore beneath the waves.","Family, Couples, Indeviduals,Group",4 Hours,25,15,"Transportation, Guide, Equipment, Meals","Drinks, Shoping, Guide Tips,",4/1/2025,1/1/2030,20,John Doe - Licensed Egyptologist,10-20 people,Hotel Lobby,08:00 a.m,04:30 p.m,4.7/14,74,Picture,info@egypttrips.com,+20 123 456 789,"towel,suncream, Cash, Walking shose",Moderate,"English, French, German, Arabic, Russian., Polish,",2-70 Year Old,"Bus, Van, Boat","Lunch, Snacks",Free cancellation within 24 hours,Wheelchair accessible,10% off for groups of 4 or more,Every Day
TRIP006,Sharm El Sheikh,Open Water PADI Course,"Starting your scuba diving journey with a PADI Open Water Diver course in Sharm El Sheikh is a fantastic decision! With some of the most renowned dive sites and crystal-clear waters, it’s an ideal place to take the plunge. The course offers a well-rounded experience, including diving sessions, pool training to build your skills, and yacht dives that let you explore the breathtaking underwater world in style. It’s the perfect blend of learning and adventure!","Family, Couples, Indeviduals,Group",Half Day,350,350,"Transportation, Guide, Equipment, Meals","Drinks, Shoping, Guide Tips,",4/1/2025,1/1/2030,20,John Doe - Licensed Egyptologist,10-20 people,Hotel Lobby,08:00 a.m,04:30 p.m,4.7/18,88,Picture,info@egypttrips.com,+20 123 456 789,"towel,suncream, Cash, Walking shose",Moderate,"English, French, German, Arabic, Russian., Polish,",2-70 Year Old,"Bus, Van, Boat","Lunch, Snacks",Free cancellation within 24 hours,Wheelchair accessible,10% off for groups of 4 or more,Every Day
TRIP007,Sharm El Sheikh,Advanced Open PADI Course,"Taking the PADI Advanced Open Water Diver course is a fantastic way to elevate your diving expertise while immersing yourself in the beauty of the Red Sea. It offers the perfect blend of skill-building and adventure, allowing you to confidently navigate renowned dive sites and explore even deeper into this underwater paradise. It's an unforgettable step forward in your diving journey!","Family, Couples, Indeviduals,Group",Half Day,320,320,"Transportation, Guide, Entrance Fees, Meals","Drinks, Shoping, Guide Tips,",4/1/2025,1/1/2030,20,John Doe - Licensed Egyptologist,10-20 people,Hotel Lobby,08:00 a.m,04:30 p.m,4.5/18,89,Picture,info@egypttrips.com,+20 123 456 789,"towel,suncream, Cash, Walking shose",Easy,"English, French, German, Arabic, Russian., Polish,",2-70 Year Old,"Bus, Van, Boat","Lunch, Snacks",Free cancellation within 24 hours,Wheelchair accessible,10% off for groups of 4 or more,Every Day
TRIP008,Sharm El Sheikh,Discover Scuba,This one-day introductory program sounds like the perfect way to dip your toes into the world of scuba diving! No certification? No problem—your professional instructor has you covered. They’ll walk you through the essentials and then take you on an actual dive in the open water. It's the ideal combination of learning and adventure for anyone curious about exploring the underwater world.,"Family, Couples, Indeviduals,Group",Full day,38,38,"Transportation, Guide, Entrance Fees, Meals","Drinks, Shoping, Guide Tips,",4/1/2025,1/1/2030,20,John Doe - Licensed Egyptologist,10-20 people,Hotel Lobby,08:00 a.m,04:30 p.m,4.5/18,89,Picture,info@egypttrips.com,+20 123 456 789,"suncream, Cash, Walking shose",Easy,"English, French, German, Arabic, Russian., Polish,",2-70 Year Old,"Bus, Van, Boat","Lunch, Snacks",Free cancellation within 24 hours,Wheelchair accessible,10% off for groups of 4 or more,Every Day
TRIP009,Sharm El Sheikh,Pirates Sailing Yacht,"Imagine gliding across the water on a timeless twin-masted schooner, where luxury and relaxation come together seamlessly. With expansive sun decks offering plush mattresses for ultimate comfort, shaded areas to escape the heat, and an air-conditioned lounge complete with a plasma TV, every detail is designed to enhance your experience. It’s the perfect way to unwind in style while soaking in the beauty of the open sea. A true touch of elegance on the waves!","Family, Couples, Indeviduals,Group",6 Hours,75,40,"Transportation, Guide, Equipment, Meals","Drinks, Shoping, Guide Tips,",4/1/2025,1/1/2030,20,John Doe - Licensed Egyptologist,10-20 people,Hotel Lobby,08:00 a.m,04:30 p.m,4.7/18,88,Picture,info@egypttrips.com,+20 123 456 789,"towel,suncream, Cash, Walking shose",Moderate,"English, French, German, Arabic, Russian., Polish,",2-70 Year Old,"Bus, Van, Boat","Lunch, Snacks",Free cancellation within 24 hours,Wheelchair accessible,10% off for groups of 4 or more,Every Day
TRIP010,Sharm El Sheikh,ELITE VIP Cruise from Luxor,"Step aboard the ultimate Elite Sailing Yacht and immerse yourself in sheer luxury. These state-of-the-art yachts boast expansive sun decks furnished with comfortable loungers, alongside sophisticated hospitality salons designed for elegance and relaxation. As you sail, you’ll enjoy breathtaking panoramic views of the dazzling turquoise sea, creating a sailing experience that’s as indulgent as it is unforgettable. It’s the epitome of refined travel on the open water.","Family, Couples, Indeviduals,Group",Half Day,75,40,"Transportation, Guide, Entrance Fees, Meals","Drinks, Shoping, Guide Tips,",4/1/2025,1/1/2030,20,John Doe - Licensed Egyptologist,10-20 people,Hotel Lobby,08:00 a.m,04:30 p.m,4.5/18,89,Picture,info@egypttrips.com,+20 123 456 789,"suncream, Cash, Walking shose",Easy,"English, French, German, Arabic, Russian., Polish,",2-70 Year Old,"Bus, Van, Boat","Lunch, Snacks",Free cancellation within 24 hours,Wheelchair accessible,10% off for groups of 4 or more,Every Day
TRIP011,Sharm El Sheikh,Tiran Island Snorkeling,"The Tiran Island Adventure offers an unforgettable day on the water! Begin with a picturesque boat ride, soaking in the stunning views of the Gulf of Aqaba. Dive into excitement with two snorkeling stops at Jack Reef, each lasting 45 minutes, where vibrant marine life awaits. To top it all off, savor a delicious lunch served onboard as you relax and take in the beauty of your surroundings. It’s the perfect combination of exploration and indulgence.","Family, Couples, Indeviduals,Group",Half Day,20,10,"Transportation, Guide, Equipment, Meals","Drinks, Shoping, Guide Tips,",4/1/2025,1/1/2030,20,John Doe - Licensed Egyptologist,10-20 people,Hotel Lobby,08:00 a.m,04:00 p.m,4.7/12,66,Picture,info@egypttrips.com,+20 123 456 789,"towel,suncream, Cash, Walking shose",Moderate,"English, French, German, Arabic, Russian., Polish,",2-70 Year Old,"Bus, Van, Boat","Lunch, Snacks",Free cancellation within 24 hours,Wheelchair accessible,10% off for groups of 4 or more,Every Day
TRIP012,Sharm El Sheikh,Tiran Island Diving,"The Tiran Island Adventure promises a delightful day on the water! Begin with a scenic boat ride, taking in the stunning views of the Gulf of Aqaba. Dive into the underwater world with a 25-minute dive session at Jack Reef, followed by a 45-minute snorkeling experience to explore even more of the vibrant marine life. After your aquatic adventures, indulge in a delicious lunch served onboard, making it the perfect balance of exploration and relaxation.","Family, Couples, Indeviduals,Group",Half Day,35,35,"Transportation, Guide, Entrance Fees, Meals","Drinks, Shoping, Guide Tips,",4/1/2025,1/1/2030,20,John Doe - Licensed Egyptologist,10-20 people,Hotel Lobby,08:00 a.m,04:30 p.m,4.5/18,89,Picture,info@egypttrips.com,+20 123 456 789,"towel,suncream, Cash, Walking shose",Easy,"English, French, German, Arabic, Russian., Polish,",2-70 Year Old,"Bus, Van, Boat","Lunch, Snacks",Free cancellation within 24 hours,Wheelchair accessible,10% off for groups of 4 or more,Every Day
TRIP013,Sharm El Sheikh,Sinai Dreams Dinner Cruise,"Embark on an unforgettable journey aboard the most luxurious Turkish Yacht, where elegance and comfort are paramount. Dive into an incredible snorkeling experience, exploring the vibrant underwater world in style. Feel pampered with exceptional hospitality throughout your adventure, and indulge in a delectable meal served onboard. It’s the perfect way to blend luxury, exploration, and relaxation into one extraordinary experience.","Family, Couples, Indeviduals,Group",6 Hours,30,15,"Transportation, Guide, Entrance Fees, Meals","Drinks, Shoping, Guide Tips,",4/1/2025,1/1/2030,20,John Doe - Licensed Egyptologist,10-20 people,Hotel Lobby,05:00 p.m,09:00 p.m,4.5/18,89,Picture,info@egypttrips.com,+20 123 456 789,"suncream, Cash, Walking shose",Easy,"English, French, German, Arabic, Russian., Polish,",2-70 Year Old,"Bus, Van, Boat","Lunch, Snacks",Free cancellation within 24 hours,Wheelchair accessible,10% off for groups of 4 or more,Every Day
TRIP014,Sharm El Sheikh,Quad Biking Safari in the Desert,"Discover the breathtaking beauty of the Sinai Dunes as you journey through its vast sandscapes and rugged terrains. This adventure invites you to fully immerse yourself in the natural wonders of the region, offering a unique opportunity to experience its raw, untamed charm. Witness the sun setting over the dunes, casting golden hues across the landscape, and take part in the fascinating Echo Experience, adding a touch of magic to your exploration. It's a journey like no other!","Family, Couples, Indeviduals,Group",4 Hours,20,10,"Transportation, Guide, Equipment, Meals","Drinks, Shoping, Guide Tips,",4/1/2025,1/1/2030,20,John Doe - Licensed Egyptologist,10-20 people,Hotel Lobby,02:00 p.m,05:00 p.m,4.7/11,62,Picture,info@egypttrips.com,+20 123 456 789,"towel,suncream, Cash, Walking shose",Moderate,"English, French, German, Arabic, Russian., Polish,",2-70 Year Old,"Bus, Van, Boat","Lunch, Snacks",Free cancellation within 24 hours,Wheelchair accessible,10% off for groups of 4 or more,Every Day
TRIP015,Sharm El Sheikh,Sunset Desert Safari,"Embarking on a sunset quad ride promises an unforgettable thrill as you speed across the shifting dunes, surrounded by the mesmerizing beauty of the desert at dusk. As the day fades into night, the captivating landscapes come alive with golden and amber hues. The adventure continues as you navigate the rugged terrain alongside camels, adding an authentic touch to the journey. Finally, unwind with a mouthwatering BBQ dinner under the stars, hosted in the warm, welcoming ambiance of a traditional Bedouin tent. A perfect blend of excitement, culture, and tranquility!","Family, Couples, Indeviduals,Group",4 Hours,35,20,"Transportation, Guide, Equipment, Meals","Drinks, Shoping, Guide Tips,",4/1/2025,1/1/2030,20,John Doe - Licensed Egyptologist,10-20 people,Hotel Lobby,04:00 p.m,06:50 p.m,4.7/12,64,Picture,info@egypttrips.com,+20 123 456 789,"towel,suncream, Cash, Walking shose",Moderate,"English, French, German, Arabic, Russian., Polish,",2-70 Year Old,"Bus, Van, Boat","Lunch, Snacks",Free cancellation within 24 hours,Wheelchair accessible,10% off for groups of 4 or more,Every Day
TRIP016,Sharm El Sheikh,Blue Hole Salama Canyon Jeep Safari,"Salama Canyon is a true natural masterpiece, with its stunningly vibrant, multicolored rock formations and intricate narrow passageways shaped by ancient geological forces. Exploring its captivating walls, adorned with a spectrum of colors, is like stepping into an artist's dream. The adventure doesn’t stop there—next, dive into the legendary Blue Hole for an unforgettable snorkeling experience, then traverse the shoreline on camelback for a taste of tradition. Finally, unwind with a delightful lunch, making this journey a perfect blend of exploration, adventure, and relaxation.","Family, Couples, Indeviduals,Group",Half Day,50,25,"Transportation, Guide, Entrance Fees, Meals","Drinks, Shoping, Guide Tips,",4/1/2025,1/1/2030,20,John Doe - Licensed Egyptologist,10-20 people,Hotel Lobby,08:00 a.m,05:00 p.m,4.5/12,65,Picture,info@egypttrips.com,+20 123 456 789,"towel,suncream, Cash, Walking shose",Easy,"English, French, German, Arabic, Russian., Polish,",2-70 Year Old,"Bus, Van, Boat","Lunch, Snacks",Free cancellation within 24 hours,Wheelchair accessible,10% off for groups of 4 or more,Every Day
TRIP017,Sharm El Sheikh,Camel Ride and Bedouin Dinner,"Embark on a journey through the golden sands, retracing the footsteps of the Bedouins who have roamed these dunes for centuries. Experience the serenity of a camel ride as you take in the vast and picturesque landscapes. Savor traditional tea while seated around a cozy fire, and immerse yourself in the rich heritage by hearing stories and learning about the Bedouin way of life. It’s an unforgettable blend of adventure, culture, and timeless tradition.","Family, Couples, Indeviduals,Group",6 Hours,15,10,"Transportation, Guide, Entrance Fees, Meals","Drinks, Shoping, Guide Tips,",4/1/2025,1/1/2030,20,John Doe - Licensed Egyptologist,10-20 people,Hotel Lobby,09:00 a.m,06:00 p.m,4.5/12,67,Picture,info@egypttrips.com,+20 123 456 789,"towel,suncream, Cash, Walking shose",Easy,"English, French, German, Arabic, Russian., Polish,",2-70 Year Old,"Bus, Van, Boat","Lunch, Snacks",Free cancellation within 24 hours,Wheelchair accessible,10% off for groups of 4 or more,Every Day
TRIP018,Sharm El Sheikh,Star Gazer,"Experience the wonders of the night sky like never before as you observe constellations, planets such as Saturn and Jupiter, and the Moon through professional telescopes. Immerse yourself in the serenity of a traditional Bedouin camp, where warm hospitality welcomes you. End the evening by savoring an authentic Bedouin-style dinner under a canopy of stars, creating a truly magical and unforgettable night.","Family, Couples, Indeviduals,Group",6 Hours,30,15,"Transportation, Guide, Entrance Fees, Meals","Drinks, Shoping, Guide Tips,",4/1/2025,1/1/2030,20,John Doe - Licensed Egyptologist,10-20 people,Hotel Lobby,04:00 p.m,08:30 p.m,4.5/14,75,Picture,info@egypttrips.com,+20 123 456 789,"towel,suncream, Cash, Walking shose",Easy,"English, French, German, Arabic, Russian., Polish,",2-70 Year Old,"Bus, Van, Boat","Lunch, Snacks",Free cancellation within 24 hours,Wheelchair accessible,10% off for groups of 4 or more,Every Day
TRIP019,Sharm El Sheikh,Super Desert Safari,"Kick off your adventure with an exhilarating quad bike ride on the sleek, modern Honda Moto, zipping through the stunning desert landscapes. As evening falls, marvel at the celestial wonders—constellations, planets like Saturn and Jupiter, and the Moon—through professional telescopes for an unforgettable stargazing experience. Wind down the night in a traditional Bedouin camp, where warm hospitality and an authentic Bedouin-style dinner under the starry sky create the perfect blend of thrill and tranquility. A truly magical desert escape!","Family, Couples, Indeviduals,Group",6 Hours,30,15,"Transportation, Guide, Entrance Fees, Meals","Drinks, Shoping, Guide Tips,",4/1/2025,1/1/2030,20,John Doe - Licensed Egyptologist,10-20 people,Hotel Lobby,04:00 p.m,08:00 p.m,4.5/13,69,Picture,info@egypttrips.com,+20 123 456 789,"towel,suncream, Cash, Walking shose",Easy,"English, French, German, Arabic, Russian., Polish,",2-70 Year Old,"Bus, Van, Boat","Lunch, Snacks",Free cancellation within 24 hours,Wheelchair accessible,10% off for groups of 4 or more,Every Day
TRIP020,Sharm El Sheikh,Buggy Safari,"Dive into an exhilarating adventure through the rugged desert terrains of Sharm in the powerful Bollaris Buggy, an impressive American model designed for thrill-seekers. Feel the adrenaline rush as you navigate the Red Sea mountain chains and dunes, kicking up towering clouds of sand with every turn. It's an unmatched way to explore the raw beauty of the rocky landscapes in ultimate style and excitement!","Family, Couples, Indeviduals,Group",4 Hours,30,15,"Transportation, Guide, Equipment, Meals","Drinks, Shoping, Guide Tips,",4/1/2025,1/1/2030,20,John Doe - Licensed Egyptologist,10-20 people,Hotel Lobby,04:00 p.m,08:00 p.m,4.7/18,88,Picture,info@egypttrips.com,+20 123 456 789,"towel,suncream, Cash, Walking shose",Moderate,"English, French, German, Arabic, Russian., Polish,",2-70 Year Old,"Bus, Van, Boat","Lunch, Snacks",Free cancellation within 24 hours,Wheelchair accessible,10% off for groups of 4 or more,Every Day
TRIP021,Sharm El Sheikh,Quad Sun Rise,"Witness the awe-inspiring beauty of the desert at sunrise as you venture off the beaten path into the rocky landscapes surrounding Sharm. Feel the serenity of the early morning light as it illuminates the rugged terrain, casting stunning shadows across the sands. With each off-road turn through the Red Sea mountain chains and dunes, leave trails of golden sand in your wake. It's a thrilling escape into untouched desert beauty, perfect for the adventurous spirit.","Family, Couples, Indeviduals,Group",4 Hours,15,15,"Transportation, Guide, Entrance Fees, Meals","Drinks, Shoping, Guide Tips,",4/1/2025,1/1/2030,20,John Doe - Licensed Egyptologist,10-20 people,Hotel Lobby,04:00 a.m,06:30 a.m,4.5/18,89,Picture,info@egypttrips.com,+20 123 456 789,"towel,suncream, Cash, Walking shose",Easy,"English, French, German, Arabic, Russian., Polish,",2-70 Year Old,"Bus, Van, Boat","Lunch, Snacks",Free cancellation within 24 hours,Wheelchair accessible,10% off for groups of 4 or more,Every Day
TRIP022,Sharm El Sheikh,Camel Safari,"Immerse yourself in the authentic charm of Sharm's unique peninsula with an unforgettable Arabic camel ride. Glide through the serene desert landscapes, embracing the traditional way of travel that has been cherished for generations. As you journey, delve into the rich culture of the Bedouin tribes and witness their way of life at its most genuine. To complete this cultural experience, savor the unique flavors of Bedouin herbal tea—a perfect reflection of their time-honored traditions. It's a remarkable blend of adventure, history, and hospitality.","Family, Couples, Indeviduals,Group",4 Hours,15,10,"Transportation, Guide, Equipment, Meals","Drinks, Shoping, Guide Tips,",4/1/2025,1/1/2030,20,John Doe - Licensed Egyptologist,10-20 people,Hotel Lobby,04:00 p.m,07:00 p.m,4.7/18,88,Picture,info@egypttrips.com,+20 123 456 789,"towel,suncream, Cash, Walking shose",Moderate,"English, French, German, Arabic, Russian., Polish,",2-70 Year Old,"Bus, Van, Boat","Lunch, Snacks",Free cancellation within 24 hours,Wheelchair accessible,10% off for groups of 4 or more,Every Day
TRIP023,Sharm El Sheikh,Parasailing Adventure,"Prepare yourself for an electrifying water sports adventure in the vibrant waters of Sharm El Sheikh! Experience the exhilaration of parasailing as you glide high above the sea, take the excitement up a notch by speeding across the waves, and dive into a variety of activities designed for thrill-seekers and fun-lovers alike. Whether you're chasing adrenaline or simply looking for a splashy good time, this adventure caters to every level of excitement!","Family, Couples, Indeviduals,Group",4 Hours,20,15,"Transportation, Guide, Entrance Fees, Meals","Drinks, Shoping, Guide Tips,",4/1/2025,1/1/2030,20,John Doe - Licensed Egyptologist,10-20 people,Hotel Lobby,10:30 a.m,12:00 p.m,4.5/14,73,Picture,info@egypttrips.com,+20 123 456 789,"towel,suncream, Cash, Walking shose",Easy,"English, French, German, Arabic, Russian., Polish,",2-70 Year Old,"Bus, Van, Boat","Lunch, Snacks",Free cancellation within 24 hours,Wheelchair accessible,10% off for groups of 4 or more,Every Day
TRIP024,Sharm El Sheikh,Sinai Dreams Sailing Yacht,"Embark on a luxurious journey aboard a Deluxe Turkish Yacht, where elegance meets adventure. Sail through the pristine waters of Ras Mohamed National Park, a protected haven of natural beauty. Dive into an unforgettable snorkeling experience, exploring vibrant coral reefs and diverse marine life. This program offers the perfect blend of relaxation and exploration, making it an exceptional way to enjoy the wonders of the Red Sea.","Family, Couples, Indeviduals,Group",Half Day,60,30,"Transportation, Guide, Entrance Fees, Meals","Drinks, Shoping, Guide Tips,",4/1/2025,1/1/2030,20,John Doe - Licensed Egyptologist,10-20 people,Hotel Lobby,08:00 a.m,04:30 p.m,4.5/18,89,Picture,info@egypttrips.com,+20 123 456 789,"towel,suncream, Cash, Walking shose",Easy,"English, French, German, Arabic, Russian., Polish,",2-70 Year Old,"Bus, Van, Boat","Lunch, Snacks",Free cancellation within 24 hours,Wheelchair accessible,10% off for groups of 4 or more,Every Day
