Trip ID,Destination,Trip Name,Description,Trip Category,Duration,Price Adult,Price Child,Included in Price,Not Included,Start Date,End Date,Available Spots,Tour Guide,Group Size,Meeting Point,Departure Time,Return Time,Rating,Reviews Count,Photo URL,Contact Email,Contact Phone,What to Bring,Trip Difficulty,Languages Available,Age Restrictions,Transportation Type,Meals Included,Cancellation Policy,Accessibility,Special Offers,Trip Schedule
TRIP129,Marsa Alam,Desert super safari excursions by jeep from marsa alam,"Set off on an exhilarating desert safari adventure by 4x4 jeep from Marsa Alam, where excitement and cultural discovery await! Venture into the heart of the desert to uncover the fascinating stories and traditions of Bedouin life. Immerse yourself in their warm hospitality as you savor authentic Bedouin tea and try the unique experience of smoking a water pipe.

For thrill-seekers, take the reins and drive a quad bike across the golden sands, adding a rush of adrenaline to your journey. This unforgettable trip blends adventure, culture, and the breathtaking beauty of the desert, making it a truly remarkable experience!","Family, Couples, Indeviduals,Group",7 Hours,55,27.5,"Transportation, Guide, Entrance Fees, Meals","Drinks, Shoping, Guide Tips,",4/1/2025,1/1/2030,28,John Doe - Licensed Egyptologist,10-20 people,Hotel Lobby,09:00 a.m,06:00 p.m,4.5/16,86,Picture,info@egypttrips.com,+20 123 456 789,"towel,suncream, Cash, Walking shose",Easy,"English, French, German, Arabic, Russian., Polish,",2-70 Year Old,"Bus, Van","Lunch, Snacks",Free cancellation within 24 hours,Wheelchair accessible,10% off for groups of 4 or more,Every Day
TRIP130,Marsa Alam,Semi submarine trip from marsa alam,"Embark on an exciting Semi-Submarine adventure in Marsa Alam and witness the incredible underwater world of the Red Sea—all without getting wet! Aboard the fantastic Seascope submarine, enjoy panoramic views of vibrant coral reefs, exotic fish, and other marine wonders through large glass windows.

This unique excursion lets you immerse yourself in the beauty of marine life while staying completely dry. It's a perfect experience for those who want to explore the wonders beneath the waves in comfort and style. A must-try for families and nature enthusiasts!","Family, Couples, Indeviduals,Group",2 Hours,45,22.5,"Transportation, Guide, Entrance Fees, Meals","Drinks, Shoping, Guide Tips,",4/1/2025,1/1/2030,29,John Doe - Licensed Egyptologist,10-20 people,Hotel Lobby,08:00 a.m,04:00 p.m,4.7/16,88,Picture,info@egypttrips.com,+20 123 456 789,"towel,suncream, Cash, Walking shose",Easy,"English, French, German, Arabic, Russian., Polish,",2-70 Year Old,"Bus, Van, Boat","Lunch, Snacks",Free cancellation within 24 hours,Wheelchair accessible,10% off for groups of 4 or more,Every Day
TRIP131,Marsa Alam,Portghalib intro diving trip from marsa alam,"Dive into the stunning underwater world with an incredible diving trip from Marsa Alam to Port Ghalib! Experience the thrill of two unforgettable dives guided by a professional instructor. Explore the vibrant coral reefs and diverse marine life at Marsa Mubarak, known for its crystal-clear waters and beautiful aquatic creatures. Then head to Marsa Shouna for another spectacular dive, where you'll encounter more dazzling underwater landscapes and exotic marine species. 

This adventure is perfect for diving enthusiasts and nature lovers seeking to immerse themselves in the enchanting wonders of the Red Sea!","Family, Couples, Indeviduals,Group",7 Hours,60,30,"Transportation, Guide, Entrance Fees, Meals","Drinks, Shoping, Guide Tips,",4/1/2025,1/1/2030,30,John Doe - Licensed Egyptologist,10-20 people,Hotel Lobby,09:00 a.m,04:00 p.m,4.5/16,89,Picture,info@egypttrips.com,+20 123 456 789,"towel,suncream, Cash, Walking shose",Easy,"English, French, German, Arabic, Russian., Polish,",2-70 Year Old,"Bus, Van, Boat","Lunch, Snacks",Free cancellation within 24 hours,Wheelchair accessible,10% off for groups of 4 or more,Every Day
TRIP132,Marsa Alam,Transfer from Hurghada Airport,"Enjoy a smooth and convenient transfer from Marsa Alam Airport to your hotel in a modern, comfortable vehicle! Relax as you travel in style, with a hassle-free ride ensuring your journey is both pleasant and efficient. It's the perfect way to start your holiday with ease and comfort!","Family, Couples, Indeviduals,Group",Half Day,50,25,"Transportation, Guide, Entrance Fees, Meals","Drinks, Shoping, Guide Tips,",4/1/2025,1/1/2030,20,John Doe - Licensed Egyptologist,10-20 people,Hotel Lobby,09:00 a.m,06:00 p.m,4.5/18,89,Picture,info@egypttrips.com,+20 123 456 789,"towel,suncream, Cash, Walking shose",Easy,"English, French, German, Arabic, Russian., Polish,",2-70 Year Old,"Bus, Van, Boat","Lunch, Snacks",Free cancellation within 24 hours,Wheelchair accessible,10% off for groups of 4 or more,Every Day
TRIP133,Marsa Alam,Day Trip to Luxor from Marsa Alam: Discover Ancient Marvels,"Embark on an unforgettable day tour to Luxor from Marsa Alam, where history and wonder await! Begin your journey by marveling at the grandeur of Karnak Temple, a sprawling complex that showcases the pinnacle of ancient Egyptian architecture. Next, delve into the Valley of the Kings, where the tombs of pharaohs reveal stories of an extraordinary past.

Continue to the magnificent Hatshepsut Temple, a stunning tribute to one of Egypt's most powerful queens, blending seamlessly into the cliffs of Deir el-Bahari. To complete your adventure, opt for a peaceful felucca ride on the Nile, gliding along its gentle waters and soaking in the timeless beauty of Egypt's most iconic river. A truly enriching experience!","Family, Couples, Indeviduals,Group",Full Day,80,45,"Transportation, Guide, Entrance Fees, Meals","Drinks, Shoping, Guide Tips,",4/1/2025,1/1/2030,20,John Doe - Licensed Egyptologist,10-20 people,Hotel Lobby,04:00 a.m,06:00 p.m,4.7/17,60,Picture,info@egypttrips.com,+20 123 456 789,"towel,suncream, Cash, Walking shose",Moderate,"English, French, German, Arabic, Russian., Polish,",2-70 Year Old,Bus,"Lunch, Snacks",Free cancellation within 24 hours,Wheelchair accessible,10% off for groups of 4 or more,Every Day
TRIP134,Marsa Alam,Flight Day Trip from Marsa Alam to Cairo: Pyramids & Museum.,"Embark on an exciting Cairo Tour from Marsa Alam by Flight and experience the best of Egypt's capital in just one day! Begin your adventure with a visit to the iconic Giza Pyramids, marveling at their grandeur and the enigmatic Sphinx. Dive into history at the Egyptian Museum, home to an incredible collection of ancient artifacts, including treasures from King Tutankhamun.

Wrap up your day with a stroll through the vibrant Khan El Khalili bazaar, where you can shop for unique souvenirs and soak in the lively atmosphere. With an expert guide to enrich your journey, this tour offers a perfect blend of history, culture, and unforgettable memories!","Family, Couples, Indeviduals,Group",20 Hours,240,220,"Transportation, Guide, Entrance Fees, Meals","Drinks, Shoping, Guide Tips,",1/3/2025,1/3/2025,21,John Doe - Licensed Egyptologist,10-20 people,Hotel Lobby,12:00 a.m,04:00 p.m,4.5/17,79,Picture,info@egypttrips.com,+20 123 456 789,"towel,suncream, Cash, Walking shose",Moderate,"English, French, German, Arabic, Russian., Polish,",2-70 Year Old,"Van,Air","Lunch, Snacks",Free cancellation within 24 hours,Wheelchair accessible,10% off for groups of 4 or more,Every Day
TRIP135,Marsa Alam,Aswan day tour from marsa alam,"Embark on a Private Day Tour to Aswan from Marsa Alam and uncover the city's remarkable highlights! Begin your journey with a visit to the impressive High Dam, a modern engineering marvel that has shaped Egypt's history. Marvel at the enchanting Temple of Goddess Isis at Philae, a sacred site steeped in mythology and beauty.

Explore the intriguing Unfinished Obelisk, offering a glimpse into ancient stonecraft techniques. To complete your adventure, sail on a traditional felucca boat along the serene Nile River and immerse yourself in the vibrant Nubian culture, known for its colorful traditions and warm hospitality. This tour promises a perfect blend of history, culture, and breathtaking scenery!","Family, Couples, Indeviduals,Group",Full Day,100,50,"Transportation, Guide, Entrance Fees, Meals","Drinks, Shoping, Guide Tips,",1/3/2025,1/3/2025,22,John Doe - Licensed Egyptologist,10-20 people,Hotel Lobby,05:30 a.m,04:00 p.m,4.7/17,80,Picture,info@egypttrips.com,+20 123 456 789,"towel,suncream, Cash, Walking shose",Moderate,"English, French, German, Arabic, Russian., Polish,",2-70 Year Old,Van,"Lunch, Snacks",Free cancellation within 24 hours,Wheelchair accessible,10% off for groups of 4 or more,Every Day
TRIP136,Marsa Alam,All-Inclusive Snorkeling Tour at Satayh Dolphin Reef in Marsa Alam,"Embark on an unforgettable snorkeling trip to Satayh “Dolphin Reef” from Marsa Alam, where the magic of the Red Sea comes alive! Dive into crystal-clear waters and witness a lively pod of 60 to 80 dolphins dancing and playing right before your eyes. 

This extraordinary experience allows you to interact with these incredible creatures in their natural habitat, creating memories that will last a lifetime. Along the way, explore vibrant coral reefs and discover the diverse marine life that makes the Red Sea so enchanting. A perfect adventure for nature lovers and thrill-seekers alike!","Family, Couples, Indeviduals,Group",13 Hours,45,30,"Transportation, Guide, Entrance Fees, Meals","Drinks, Shoping, Guide Tips,",1/3/2025,1/3/2025,23,John Doe - Licensed Egyptologist,10-20 people,Hotel Lobby,05:00 a.m,06:30 p.m,4.7/18,81,Picture,info@egypttrips.com,+20 123 456 789,"towel,suncream, Cash, Walking shose",Easy,"English, French, German, Arabic, Russian., Polish,",2-70 Year Old,"Bus, Van, Boat","Lunch, Snacks",Free cancellation within 24 hours,Wheelchair accessible,10% off for groups of 4 or more,Every Day
TRIP137,Marsa Alam,Professional Snorkeling Tour at Hamata Islands: Experience from Marsa Alam,"Elevate your getaway with an extraordinary snorkeling adventure to the Hamata Islands in Marsa Alam! Discover the hidden gems of Hamata National Park as you explore three pristine islands, each offering its own unique charm. Dive into crystal-clear waters to admire vibrant coral reefs and a kaleidoscope of colorful fish in their untouched natural habitat.

This journey is perfect for nature enthusiasts and adventurers looking to immerse themselves in the serene beauty and marine wonders of the Red Sea. It's an experience that promises unforgettable memories of tranquility and awe!","Family, Couples, Indeviduals,Group",8 Hours,55,30,"Transportation, Guide, Entrance Fees, Meals","Drinks, Shoping, Guide Tips,",1/3/2025,1/3/2025,24,John Doe - Licensed Egyptologist,10-20 people,Hotel Lobby,06:00 a.m,04:00 p.m,4.5/18,82,Picture,info@egypttrips.com,+20 123 456 789,"towel,suncream, Cash, Walking shose",Easy,"English, French, German, Arabic, Russian., Polish,",2-70 Year Old,"Bus, Van, Boat","Lunch, Snacks",Free cancellation within 24 hours,Wheelchair accessible,10% off for groups of 4 or more,Every Day
TRIP138,Marsa Alam,Abu Dabbab Dugong Bay Snorkeling Adventure from Marsa Alam.,"Abu Dabbab Dugong Bay offers a snorkeling experience like no other! Dive into its calm, shallow waters—naturally shielded from the wind—and immerse yourself in a vibrant marine world. Swim alongside gentle sea turtles and the elusive dugongs, encountering these magnificent creatures in their natural habitat.

The bay’s peaceful setting and rich biodiversity make it the perfect destination for an unforgettable underwater adventure. It’s a dream come true for nature lovers and snorkeling enthusiasts alike!","Family, Couples, Indeviduals,Group",8 Hours,40,25,"Transportation, Guide, Entrance Fees, Meals","Drinks, Shoping, Guide Tips,",1/3/2025,1/3/2025,25,John Doe - Licensed Egyptologist,10-20 people,Hotel Lobby,07:00 a.m,04:00 p.m,4.7/11,83,Picture,info@egypttrips.com,+20 123 456 789,"towel,suncream, Cash, Walking shose",Easy,"English, French, German, Arabic, Russian., Polish,",2-70 Year Old,"Bus, Van, Boat","Lunch, Snacks",Free cancellation within 24 hours,Wheelchair accessible,10% off for groups of 4 or more,Every Day
TRIP139,Marsa Alam,"Sunset ATV Quad Desert Safari Tours in Marsa Alam, Egypt","Embark on a thrilling sunset quad bike journey through the captivating desert of Marsa Alam! Ride through rugged mountain trails, feeling the excitement of the open terrain as the sun begins to set. Dive into the fascinating Bedouin culture by visiting local communities and gaining insight into their traditions and way of life.

As the day concludes, marvel at the breathtaking colors of the Eastern desert sunset—a perfect combination of adventure, cultural exploration, and natural beauty. This unforgettable experience will leave you with lasting memories of Marsa Alam's enchanting landscape!","Family, Couples, Indeviduals,Group",7 Hours,25,15,"Transportation, Guide, Entrance Fees, Meals","Drinks, Shoping, Guide Tips,",1/3/2025,1/3/2025,26,John Doe - Licensed Egyptologist,10-20 people,Hotel Lobby,01:00 p.m,06:00 p.m,4.5/15,84,Picture,info@egypttrips.com,+20 123 456 789,"towel,suncream, Cash, Walking shose",Easy,"English, French, German, Arabic, Russian., Polish,",2-70 Year Old,"Bus, Van","Lunch, Snacks",Free cancellation within 24 hours,Wheelchair accessible,10% off for groups of 4 or more,Every Day
TRIP140,Marsa Alam,Camel riding marsa alam day tour,"Indulge in a delightful Camel Ride Trip that combines the serene beauty of the desert with the refreshing charm of the beach! Spend an hour traversing golden sands atop a gentle camel, a timeless mode of travel that offers a unique perspective on the surrounding landscape.

Feel the tranquil rhythm of the ride as you journey through the quiet desert, then transition to the shore, where the soft breeze and stunning coastal views await. This peaceful yet adventurous experience is the perfect way to connect with nature and create cherished memories!","Family, Couples, Indeviduals,Group",1 Hour,28,14,"Transportation, Guide, Entrance Fees, Meals","Drinks, Shoping, Guide Tips,",1/3/2025,1/3/2025,27,John Doe - Licensed Egyptologist,10-20 people,Hotel Lobby,08:00 a.m,10:00 a.m,4.7/16,85,Picture,info@egypttrips.com,+20 123 456 789,"towel,suncream, Cash, Walking shose",Easy,"English, French, German, Arabic, Russian., Polish,",2-70 Year Old,"Bus, Van","Lunch, Snacks",Free cancellation within 24 hours,Wheelchair accessible,10% off for groups of 4 or more,Every Day
TRIP141,Marsa Alam,Desert super safari excursions by jeep from marsa alam,"Embark on an exhilarating desert safari adventure by 4x4 jeep from Marsa Alam, where the golden sands hold stories waiting to be discovered! Dive into the rich Bedouin culture, learning about their traditions, lifestyle, and deep connection with the desert. Savor authentic Bedouin tea and enjoy the unique experience of smoking a water pipe under the vast open sky.

Add an adrenaline-pumping twist to your journey by taking a turn at driving a quad bike, navigating the thrilling desert terrain. This unforgettable trip combines cultural discovery, adventure, and the breathtaking beauty of Marsa Alam’s desert!","Family, Couples, Indeviduals,Group",7 Hours,55,27.5,"Transportation, Guide, Entrance Fees, Meals","Drinks, Shoping, Guide Tips,",1/3/2025,1/3/2025,28,John Doe - Licensed Egyptologist,10-20 people,Hotel Lobby,09:00 a.m,06:00 p.m,4.5/16,86,Picture,info@egypttrips.com,+20 123 456 789,"towel,suncream, Cash, Walking shose",Easy,"English, French, German, Arabic, Russian., Polish,",2-70 Year Old,"Bus, Van","Lunch, Snacks",Free cancellation within 24 hours,Wheelchair accessible,10% off for groups of 4 or more,Every Day
TRIP142,Marsa Alam,Semi submarine trip from marsa alam,"Embark on a mesmerizing Semi-Submarine excursion in Marsa Alam, where the captivating underwater beauty of the Red Sea comes to life—without getting wet! Step aboard the Seascope submarine and enjoy crystal-clear views of the vibrant coral reefs, colorful fish, and diverse marine species through expansive glass windows.

This fantastic experience allows you to immerse yourself in the wonders of the underwater world in comfort and style. Whether you're a nature lover or simply curious about marine life, this is a must-try adventure that combines relaxation and discovery!","Family, Couples, Indeviduals,Group",2 Hours,45,22.5,"Transportation, Guide, Entrance Fees, Meals","Drinks, Shoping, Guide Tips,",1/3/2025,1/3/2025,29,John Doe - Licensed Egyptologist,10-20 people,Hotel Lobby,08:00 a.m,04:00 p.m,4.7/16,88,Picture,info@egypttrips.com,+20 123 456 789,"towel,suncream, Cash, Walking shose",Easy,"English, French, German, Arabic, Russian., Polish,",2-70 Year Old,"Bus, Van, Boat","Lunch, Snacks",Free cancellation within 24 hours,Wheelchair accessible,10% off for groups of 4 or more,Every Day
TRIP143,Marsa Alam,Portghalib intro diving trip from marsa alam,"Your enthusiasm for this diving adventure shines brightly! This journey to Port Ghalib truly sounds like a dream for anyone who loves the underwater world. Exploring Marsa Mubarak's stunning coral reefs and swimming alongside marine life in their natural habitat is already captivating, but adding Marsa Shouna to the mix elevates it to a whole new level.

With a professional diving instructor to guide you, this adventure combines excitement with safety and expertise. It's the perfect way to connect with the breathtaking beauty of the Red Sea. Are there other activities or destinations you're excited about exploring? Let’s dive into more ideas if you’d like!","Family, Couples, Indeviduals,Group",7 Hours,60,30,"Transportation, Guide, Entrance Fees, Meals","Drinks, Shoping, Guide Tips,",1/3/2025,1/3/2025,30,John Doe - Licensed Egyptologist,10-20 people,Hotel Lobby,09:00 a.m,04:00 p.m,4.5/16,89,Picture,info@egypttrips.com,+20 123 456 789,"towel,suncream, Cash, Walking shose",Easy,"English, French, German, Arabic, Russian., Polish,",2-70 Year Old,"Bus, Van, Boat","Lunch, Snacks",Free cancellation within 24 hours,Wheelchair accessible,10% off for groups of 4 or more,Every Day
TRIP144,Aswan,Felucca ride on the nile in aswan,"Set sail on a serene Felucca ride in Aswan, where the soothing river breeze and breathtaking views create an unforgettable experience. Glide gracefully along the Nile on a traditional sailboat, surrounded by its tranquil waters.

Take in the charm of Elephantine Island, steeped in history and beauty, as you float by. Continue your journey to the renowned Botanical Gardens, where the vibrant greenery and peaceful atmosphere offer a refreshing escape. This enchanting ride is the perfect way to immerse yourself in the natural and cultural splendor of Aswan!","Family, Couples, Indeviduals,Group",2 Hours,19,9.5,"Transportation, Guide, Entrance Fees, Meals","Drinks, Shoping, Guide Tips,",1/3/2025,1/3/2025,53,John Doe - Licensed Egyptologist,10-20 people,Hotel Lobby,09:00 a.m,04:00 p.m,4.7/33,80,Picture,info@egypttrips.com,+20 123 456 789,"towel,suncream, Cash, Walking shose",Easy,"English, French, German, Arabic, Russian., Polish,",2-70 Year Old,"Bus, Van, Boat","Lunch, Snacks",Free cancellation within 24 hours,Wheelchair accessible,10% off for groups of 4 or more,Every Day
TRIP145,Aswan,Aswan city tour by horse carriage,"Immerse yourself in the vibrant charm of Aswan with captivating city tours and trips designed to showcase the authentic Egyptian lifestyle! Discover the city’s unique allure as you enjoy free walking tours or take a delightful ride in a private horse carriage. 

Stroll along the picturesque Nile Corniche, soaking in the scenic beauty and exploring the cultural treasures that define Aswan. From bustling markets to iconic landmarks, this journey offers a perfect blend of relaxation and discovery, giving you a true taste of life in this enchanting city!","Family, Couples, Indeviduals,Group",2 Hours,20,10,"Transportation, Guide, Entrance Fees, Meals","Drinks, Shoping, Guide Tips,",1/3/2025,1/3/2025,54,John Doe - Licensed Egyptologist,10-20 people,Hotel Lobby,09:00 a.m,04:00 p.m,4.7/34,81,Picture,info@egypttrips.com,+20 123 456 789,"towel,suncream, Cash, Walking shose",Easy,"English, French, German, Arabic, Russian., Polish,",2-70 Year Old,"Bus, Van, Boat","Lunch, Snacks",Free cancellation within 24 hours,Wheelchair accessible,10% off for groups of 4 or more,Every Day
TRIP146,Aswan,Aswan day tour visiting philae temple and obelisk,"Unveil the enchanting charm of Aswan and create unforgettable memories at every turn! Begin by marveling at the impressive High Dam, a testament to modern engineering that transformed Egypt's landscape. Next, delve into ancient craftsmanship as you explore the intriguing Unfinished Obelisk, a monumental glimpse into the stone-cutting techniques of the past.

Finally, lose yourself in the majestic beauty of Philae Temple, where the grandeur of its architecture and the myths of the goddess Isis come to life. Aswan truly promises a magical journey filled with history, wonder, and breathtaking moments!","Family, Couples, Indeviduals,Group",4 Hours,42,21,"Transportation, Guide, Entrance Fees, Meals","Drinks, Shoping, Guide Tips,",1/3/2025,1/3/2025,55,John Doe - Licensed Egyptologist,10-20 people,Hotel Lobby,09:00 a.m,04:00 p.m,4.7/35,82,Picture,info@egypttrips.com,+20 123 456 789,"towel,suncream, Cash, Walking shose",Easy,"English, French, German, Arabic, Russian., Polish,",2-70 Year Old,"Bus, Van, Boat","Lunch, Snacks",Free cancellation within 24 hours,Wheelchair accessible,10% off for groups of 4 or more,Every Day
TRIP147,Aswan,Tour to luxor from aswan,"Step into the timeless wonder of ancient Egypt and embark on a journey that will leave you captivated! Begin at the Valley of the Kings, where the tombs of mighty pharaohs whisper tales of glory and mystery. Then, marvel at the architectural splendor of the Temple of Luxor, standing as a proud symbol of Egypt's majestic history.

With each site you visit, you'll feel the echoes of a civilization that has fascinated the world for centuries. Every moment spent exploring these iconic landmarks becomes a treasured memory, connecting you to the extraordinary heritage of Egypt.","Family, Couples, Indeviduals,Group",12 Hours,135,67.5,"Transportation, Guide, Entrance Fees, Meals","Drinks, Shoping, Guide Tips,",1/3/2025,1/3/2025,56,John Doe - Licensed Egyptologist,10-20 people,Hotel Lobby,09:00 a.m,04:00 p.m,4.7/36,83,Picture,info@egypttrips.com,+20 123 456 789,"towel,suncream, Cash, Walking shose",Moderate,"English, French, German, Arabic, Russian., Polish,",2-70 Year Old,"Bus, Van, Boat","Lunch, Snacks",Free cancellation within 24 hours,Wheelchair accessible,10% off for groups of 4 or more,Every Day
TRIP148,Aswan,Day tour to cairo from aswan by flight,"Take an inspiring journey from Aswan to Cairo and immerse yourself in Egypt's timeless allure! Witness the breathtaking grandeur of the Pyramids and the enigmatic Sphinx, symbols of ancient ingenuity and mystery. Step into the Egyptian Museum and marvel at its vast collection of artifacts that bring Egypt’s fascinating history to life.

Delve into the spiritual charm of Coptic Cairo, where historic churches and serene alleyways reveal a rich tapestry of culture. Finally, soak in the vibrant energy of Khan El Khalili bazaar, a bustling marketplace filled with unique treasures and lively encounters. Each moment in Cairo weaves a new story, creating memories to be cherished forever!","Family, Couples, Indeviduals,Group",16 Hours,440,220,"Transportation, Guide, Entrance Fees, Meals","Drinks, Shoping, Guide Tips,",1/3/2025,1/3/2025,57,John Doe - Licensed Egyptologist,10-20 people,Hotel Lobby,09:00 a.m,04:00 p.m,4.7/37,84,Picture,info@egypttrips.com,+20 123 456 789,"towel,suncream, Cash, Walking shose",Moderate,"English, French, German, Arabic, Russian., Polish,",2-70 Year Old,"Bus, Van, Boat","Lunch, Snacks",Free cancellation within 24 hours,Wheelchair accessible,10% off for groups of 4 or more,Every Day
TRIP149,Aswan,Private Abu Simbel Tour from Aswan: Exclusive Day Trip with Expert Guide,"Embark on an enchanting journey to Abu Simbel, where history and grandeur converge in two magnificent temples. Marvel at the awe-inspiring Sun Temple of Ramses II, a breathtaking monument dedicated to the gods and the king's eternal legacy. Admire its colossal statues and intricate carvings that stand as a testament to ancient Egypt's architectural brilliance.

Then, step into the equally mesmerizing Temple of Nefertari, a tribute to the queen and the goddess Hathor. Its beauty and elegance capture the essence of devotion and artistry. This journey offers a profound connection to Egypt's glorious past, leaving you with memories of wonder and admiration!","Family, Couples, Indeviduals,Group",8 Hours,90,45,"Transportation, Guide, Entrance Fees, Meals","Drinks, Shoping, Guide Tips,",1/3/2025,1/3/2025,58,John Doe - Licensed Egyptologist,10-20 people,Hotel Lobby,09:00 a.m,04:00 p.m,4.7/38,85,Picture,info@egypttrips.com,+20 123 456 789,"towel,suncream, Cash, Walking shose",Moderate,"English, French, German, Arabic, Russian., Polish,",2-70 Year Old,"Bus, Van, Boat","Lunch, Snacks",Free cancellation within 24 hours,Wheelchair accessible,10% off for groups of 4 or more,Every Day
