Trip ID,Destination,Trip Name,Description,Trip Category,Duration,Price Adult,Price Child,Included in Price,Not Included,Start Date,End Date,Available Spots,Tour Guide,Group Size,Meeting Point,Departure Time,Return Time,Rating,Reviews Count,Photo URL,Contact Email,Contact Phone,What to Bring,Trip Difficulty,Languages Available,Age Restrictions,Transportation Type,Meals Included,Cancellation Policy,Accessibility,Special Offers,Trip Schedule
TRIP047,Luxor,Luxor Temple Visit Adventure,"Immerse yourself in the splendor of Luxor Temple, an extraordinary ancient masterpiece that comes to life when illuminated. Wander through its grand colonnades, admire the towering statues of the pharaohs, and marvel at the intricate hieroglyphs that share the stories of Egypt's remarkable legacy. This temple tour unveils a rich history, including its significant link to Karnak and its role in the Opet Festival—a celebration of renewal and unity. A visit to Luxor Temple is truly a journey back in time, filled with beauty and wonder that cannot be missed.","Family, Couples, Indeviduals,Group",6 Hours,25,15,"Transportation, Guide, Entrance Fees, Meals","Drinks, Shoping, Guide Tips,",4/1/2025,1/1/2030,20,John Doe - Licensed Egyptologist,10-20 people,Hotel Lobby,09:00 a.m,06:00 p.m,4.5/5,40,Picture,info@egypttrips.com,+20 123 456 789,"towel,suncream, Cash, Walking shose",Easy,"English, French, German, Arabic, Russian., Polish,",2-70 Year Old,"Bus, Van, Boat","Lunch, Snacks",Free cancellation within 24 hours,Wheelchair accessible,10% off for groups of 4 or more,Every Day
TRIP048,Luxor,Valley of the Kings Discovery,"Delve into the mysteries of the legendary Valley of the Kings, a captivating burial ground for ancient pharaohs, including the renowned King Tutankhamun. As you explore, you'll encounter stunningly decorated tombs adorned with intricate hieroglyphs and awe-inspiring artwork that narrates tales of the past. Step into well-preserved burial chambers that reveal the grandeur and significance of Egypt's royal heritage.

With the guidance of an expert, uncover the secrets and stories of this UNESCO World Heritage site, learning about its historical and archaeological significance. This extraordinary journey is a dream come true for history enthusiasts and archaeology lovers, offering a profound connection to Egypt's fascinating legacy.","Family, Couples, Indeviduals,Group",6 Hours,30,15,"Transportation, Guide, Equipment, Meals","Drinks, Shoping, Guide Tips,",4/1/2025,1/1/2030,20,John Doe - Licensed Egyptologist,10-20 people,Hotel Lobby,09:00 a.m,04:00 p.m,4.7/6,40,Picture,info@egypttrips.com,+20 123 456 789,"towel,suncream, Cash, Walking shose",Moderate,"English, French, German, Arabic, Russian., Polish,",2-70 Year Old,"Bus, Van, Boat","Lunch, Snacks",Free cancellation within 24 hours,Wheelchair accessible,10% off for groups of 4 or more,Every Day
TRIP049,Luxor,Karnak and Luxor Temples Adventure,"Embark on an incredible journey through ancient Egypt as you explore two of its most iconic sites: the awe-inspiring Karnak and Luxor Temples. At Karnak, wander through its sprawling temple complex, home to towering columns, sacred obelisks, and intricate carvings that reflect the grandeur of the pharaohs. Then, step into the magnificence of Luxor Temple, beautifully illuminated and brimming with rich history.

With expert guidance, you'll uncover the stories of the pharaohs, gods, and sacred rituals that brought these landmarks to life. This unforgettable tour offers a deep connection to the history, culture, and legacy of ancient Egypt. A must-experience adventure for anyone captivated by the wonders of the past!","Family, Couples, Indeviduals,Group",6 Hours,40,20,"Transportation, Guide, Entrance Fees, Meals","Drinks, Shoping, Guide Tips,",4/1/2025,1/1/2030,20,John Doe - Licensed Egyptologist,10-20 people,Hotel Lobby,09:00 a.m,06:00 p.m,4.5/6,41,Picture,info@egypttrips.com,+20 123 456 789,"towel,suncream, Cash, Walking shose",Easy,"English, French, German, Arabic, Russian., Polish,",2-70 Year Old,"Bus, Van, Boat","Lunch, Snacks",Free cancellation within 24 hours,Wheelchair accessible,10% off for groups of 4 or more,Every Day
TRIP050,Luxor,Hatshepsut Temple and West Bank Discovery Tour,"Embark on an extraordinary journey into the world of ancient pharaohs with this captivating Hatshepsut Temple & West Bank Tour! Be awed by the grandeur of Queen Hatshepsut's cliffside temple, a masterpiece of ancient architecture that celebrates the legacy of Egypt’s most powerful queen. Next, marvel at the iconic Colossi of Memnon, two towering statues steeped in mystery and history.

Continue your adventure by exploring the hidden treasures of the West Bank, where ancient tombs reveal fascinating stories of a bygone era. As you walk through these remarkable sites, soak in the breathtaking desert views that surround you. This tour is a perfect blend of history, culture, and fun—creating memories you’ll treasure forever!","Family, Couples, Indeviduals,Group",6 hours,40,20,"Transportation, Guide, Equipment, Meals","Drinks, Shoping, Guide Tips,",4/1/2025,1/1/2030,20,John Doe - Licensed Egyptologist,10-20 people,Hotel Lobby,09:00 a.m,04:00 p.m,4.7/6,42,Picture,info@egypttrips.com,+20 123 456 789,"towel,suncream, Cash, Walking shose",Moderate,"English, French, German, Arabic, Russian., Polish,",2-70 Year Old,"Bus, Van, Boat","Lunch, Snacks",Free cancellation within 24 hours,Wheelchair accessible,10% off for groups of 4 or more,Every Day
TRIP051,Luxor,Dendera and Abydos Temples Experience Trip,"Immerse yourself in the grandeur of Egypt's ancient dynasties with a captivating exploration of Dendera and Abydos Temples. Begin at the Temple of Hathor in Dendera, where you'll marvel at the beautifully preserved vibrant ceiling adorned with intricate zodiac carvings. Feel the timeless connection to ancient celestial beliefs as you uncover the temple's wonders.

Continue your journey to Abydos, home to the magnificent Temple of Seti I, a masterpiece of architecture and artistry. Step into the sacred Osirion, shrouded in mystery and steeped in significance as a tribute to Osiris, the god of the afterlife. These breathtaking sites provide a glimpse into the spiritual and cultural greatness of Egypt’s past—a dream come true for history enthusiasts and curious adventurers!","Family, Couples, Indeviduals,Group",8 Hours,40,20,"Transportation, Guide, Entrance Fees, Meals","Drinks, Shoping, Guide Tips,",4/1/2025,1/1/2030,20,John Doe - Licensed Egyptologist,10-20 people,Hotel Lobby,09:00 a.m,06:00 p.m,4.5/6,43,Picture,info@egypttrips.com,+20 123 456 789,"towel,suncream, Cash, Walking shose",Easy,"English, French, German, Arabic, Russian., Polish,",2-70 Year Old,"Bus, Van, Boat","Lunch, Snacks",Free cancellation within 24 hours,Wheelchair accessible,10% off for groups of 4 or more,Every Day
TRIP052,Luxor,Edfu and Kom Ombo Temples Tour,"Set out on an exciting adventure with the Edfu & Kom Ombo Temples Tour, where Egypt's captivating history comes alive! Begin at the impressive Temple of Horus in Edfu, celebrated as one of the most well-preserved temples. Marvel at its towering walls and intricate mythical carvings that narrate the tales of the god Horus and ancient Egyptian rituals.

Next, journey to Kom Ombo, a remarkable double temple uniquely dedicated to two gods: Sobek, the crocodile deity, and Horus, the falcon-headed protector. With its breathtaking views of the Nile, Kom Ombo offers an unforgettable blend of architectural beauty and serene surroundings. This adventure is perfect for history buffs and thrill-seekers alike!","Family, Couples, Indeviduals,Group",8 Hours,40,20,"Transportation, Guide, Equipment, Meals","Drinks, Shoping, Guide Tips,",4/1/2025,1/1/2030,20,John Doe - Licensed Egyptologist,10-20 people,Hotel Lobby,09:00 a.m,04:00 p.m,4.7/7,44,Picture,info@egypttrips.com,+20 123 456 789,"towel,suncream, Cash, Walking shose",Moderate,"English, French, German, Arabic, Russian., Polish,",2-70 Year Old,"Bus, Van, Boat","Lunch, Snacks",Free cancellation within 24 hours,Wheelchair accessible,10% off for groups of 4 or more,Every Day
TRIP053,Luxor,Hot Air Balloon Ride over Luxor,"Take to the skies for an unforgettable Hot Air Balloon Ride above Luxor's legendary landscapes! As the sun rises, its golden rays illuminate the majestic Valley of the Kings, the sprawling Karnak Temple, and the serene Nile River, painting the desert in breathtaking hues. Enjoy the tranquil beauty and capture stunning aerial views of Egypt's most iconic treasures. This once-in-a-lifetime adventure promises a magical journey that will forever stay in your heart!","Family, Couples, Indeviduals,Group",4 Hours,80,80,"Transportation, Guide, Entrance Fees, Meals","Drinks, Shoping, Guide Tips,",4/1/2025,1/1/2030,20,John Doe - Licensed Egyptologist,10-20 people,Hotel Lobby,03:30 a.m,06:15 a.m,4.5/7,45,Picture,info@egypttrips.com,+20 123 456 789,"towel,suncream, Cash, Walking shose",Easy,"English, French, German, Arabic, Russian., Polish,",2-70 Year Old,"Bus, Van, Boat","Lunch, Snacks",Free cancellation within 24 hours,Wheelchair accessible,10% off for groups of 4 or more,Every Day
TRIP054,Luxor,Nile River Cruise,"Embark on a magnificent Nile River Cruise, blending history, luxury, and serene beauty as you journey along Egypt’s legendary waterway. Relax in world-class comfort as you drift past ancient temples, lush riverbanks, and charming villages that offer glimpses of Egypt’s timeless allure. Explore iconic landmarks like Karnak, Luxor, Edfu, and Aswan, with expert-guided tours at each stop enriching your connection to these fascinating sites.

This cruise provides the perfect harmony of exploration and relaxation, ensuring an unforgettable experience as you immerse yourself in the wonders of Egypt. It’s an elegant and peaceful way to witness the heart of this magical land!","Family, Couples, Indeviduals,Group",3 days,500,450,"Transportation, Guide, Equipment, Meals","Drinks, Shoping, Guide Tips,",4/1/2025,1/1/2030,20,John Doe - Licensed Egyptologist,10-20 people,Hotel Lobby,12:00 p.m,04:00 p.m,4.7/7,46,Picture,info@egypttrips.com,+20 123 456 789,"towel,suncream, Cash, Walking shose",Moderate,"English, French, German, Arabic, Russian., Polish,",2-70 Year Old,"Bus, Van, Boat","Lunch, Snacks",Free cancellation within 24 hours,Wheelchair accessible,10% off for groups of 4 or more,Every Day
TRIP055,Luxor,Nile River Felucca Ride,"Escape into tranquility with a traditional Nile River Felucca Ride, where peace meets timeless charm. Let the gentle breeze carry you along as you glide through Egypt’s iconic river, passing lush landscapes, ancient temples, and mesmerizing sunsets. Whether it’s a romantic getaway or a quiet moment to recharge, this experience offers serenity and beauty like no other. It’s a journey through Egypt’s soul, perfect for creating unforgettable memories.","Family, Couples, Indeviduals,Group",3 Hours,15,10,"Transportation, Guide, Entrance Fees, Meals","Drinks, Shoping, Guide Tips,",4/1/2025,1/1/2030,20,John Doe - Licensed Egyptologist,10-20 people,Hotel Lobby,12:00 p.m,02:00 p.m,4.5/7,47,Picture,info@egypttrips.com,+20 123 456 789,"towel,suncream, Cash, Walking shose",Easy,"English, French, German, Arabic, Russian., Polish,",2-70 Year Old,"Bus, Van, Boat","Lunch, Snacks",Free cancellation within 24 hours,Wheelchair accessible,10% off for groups of 4 or more,Every Day
TRIP056,Luxor,Sunrise Felucca Ride,"Begin your day with a touch of magic on a serene Sunrise Felucca Ride along the Nile River. Drift through the calm waters as the soft, golden light of dawn reveals the majestic ancient temples and verdant landscapes surrounding you. With the cool morning breeze and the tranquil atmosphere, it's an experience that rejuvenates the soul and captures the timeless beauty of Egypt. A perfect way to start your day feeling inspired and at peace!","Family, Couples, Indeviduals,Group",3 Hours,15,10,"Transportation, Guide, Equipment, Meals","Drinks, Shoping, Guide Tips,",4/1/2025,1/1/2030,20,John Doe - Licensed Egyptologist,10-20 people,Hotel Lobby,04:00 a.m,06:00 a.m,4.7/8,48,Picture,info@egypttrips.com,+20 123 456 789,"towel,suncream, Cash, Walking shose",Moderate,"English, French, German, Arabic, Russian., Polish,",2-70 Year Old,"Bus, Van, Boat","Lunch, Snacks",Free cancellation within 24 hours,Wheelchair accessible,10% off for groups of 4 or more,Every Day
TRIP057,Luxor,Luxor West Bank Tour,"Experience the magic of Luxor as you dive into its captivating historical treasures! Begin your journey at the iconic Valley of the Kings, where intricately adorned tombs of ancient pharaohs reveal stories of Egypt's glorious past. Next, marvel at the architectural grandeur of Hatshepsut's Temple, a masterpiece that reflects the legacy of one of Egypt's most powerful queens.

End your adventure with the mesmerizing Sound & Light Show at Karnak, where history comes alive in an unforgettable display of lights and narration. This immersive journey blends ancient history with vibrant culture, offering you a connection to the timeless wonders of Luxor that you'll treasure forever!","Family, Couples, Indeviduals,Group",8 Hours,75,45,"Transportation, Guide, Entrance Fees, Meals","Drinks, Shoping, Guide Tips,",4/1/2025,1/1/2030,44,John Doe - Licensed Egyptologist,10-20 people,Hotel Lobby,09:00 a.m,04:00 p.m,4.7/24,71,Picture,info@egypttrips.com,+20 123 456 789,"towel,suncream, Cash, Walking shose",Easy,"English, French, German, Arabic, Russian., Polish,",2-70 Year Old,"Bus, Van, Boat","Lunch, Snacks",Free cancellation within 24 hours,Wheelchair accessible,10% off for groups of 4 or more,Every Day
TRIP058,Luxor,Quad Bike Safari at Luxor from the West Bank,"Embark on an exhilarating quad biking adventure through the Pharaohs’ ancient land and immerse yourself in the captivating magic of Egypt! Feel the thrill as you journey across golden sands and historic landscapes, connecting with the timeless beauty of this incredible region. Along the way, enjoy the warm and welcoming hospitality of the South of Egypt, where rich traditions and genuine kindness create an unforgettable experience. It's a perfect blend of excitement, history, and cultural connection!","Family, Couples, Indeviduals,Group",2 Hours,45,22.5,"Transportation, Guide, Entrance Fees, Meals","Drinks, Shoping, Guide Tips,",4/1/2025,1/1/2030,45,John Doe - Licensed Egyptologist,10-20 people,Hotel Lobby,09:00 a.m,04:00 p.m,4.7/25,72,Picture,info@egypttrips.com,+20 123 456 789,"towel,suncream, Cash, Walking shose",Easy,"English, French, German, Arabic, Russian., Polish,",2-70 Year Old,"Bus, Van, Boat","Lunch, Snacks",Free cancellation within 24 hours,Wheelchair accessible,10% off for groups of 4 or more,Every Day
TRIP059,Luxor,Felucca Ride on the Nile in Luxor,"Set sail on a timeless felucca ride along the majestic Nile in Luxor, where every moment feels like a step into history. Let the enchanting city lights dance on the water as the warmth of the day gently transitions to a serene evening. Whether you’re seeking a peaceful retreat or celebrating a special occasion, this tranquil journey offers the perfect setting to create unforgettable memories. It’s an experience that beautifully blends relaxation with the magic of Luxor!","Family, Couples, Indeviduals,Group",2 Hours,20,10,"Transportation, Guide, Entrance Fees, Meals","Drinks, Shoping, Guide Tips,",4/1/2025,1/1/2030,46,John Doe - Licensed Egyptologist,10-20 people,Hotel Lobby,09:00 a.m,04:00 p.m,4.7/26,73,Picture,info@egypttrips.com,+20 123 456 789,"towel,suncream, Cash, Walking shose",Easy,"English, French, German, Arabic, Russian., Polish,",2-70 Year Old,"Bus, Van, Boat","Lunch, Snacks",Free cancellation within 24 hours,Wheelchair accessible,10% off for groups of 4 or more,Every Day
TRIP060,Luxor,Luxor city tour by horse carriage,"Discover the charm of Luxor on a delightful Horse Carriage City Tour, where tradition meets adventure. Glide through the vibrant streets and alleys, taking in the city's enchanting atmosphere and iconic landmarks. This unique experience allows you to connect with the authentic Egyptian lifestyle, from its bustling markets to its rich culture. It’s a journey that combines history, elegance, and local flavor, leaving you with cherished memories of Luxor's timeless beauty.","Family, Couples, Indeviduals,Group",2 Hours,20,10,"Transportation, Guide, Entrance Fees, Meals","Drinks, Shoping, Guide Tips,",4/1/2025,1/1/2030,47,John Doe - Licensed Egyptologist,10-20 people,Hotel Lobby,04:00 p.m,07:30 p.m,4.7/27,74,Picture,info@egypttrips.com,+20 123 456 789,"towel,suncream, Cash, Walking shose",Easy,"English, French, German, Arabic, Russian., Polish,",2-70 Year Old,"Bus, Van, Boat","Lunch, Snacks",Free cancellation within 24 hours,Wheelchair accessible,10% off for groups of 4 or more,Every Day
TRIP061,Luxor,"Experience the Magic of a Hot Air Balloon Ride Over Luxor, Egypt","Embark on a magical hot air balloon adventure above the enchanting city of Luxor! As dawn breaks, watch the golden light illuminate ancient wonders like the Valley of the Kings, Karnak Temple, and the serene Nile. This breathtaking journey offers a bird's-eye view of history, creating unforgettable memories in the tranquil morning sky. Let this unique experience become the highlight of your visit to Luxor!","Family, Couples, Indeviduals,Group",2 Hours,45,25,"Transportation, Guide, Entrance Fees, Meals","Drinks, Shoping, Guide Tips,",4/1/2025,1/1/2030,48,John Doe - Licensed Egyptologist,10-20 people,Hotel Lobby,03:30 a.m,06:30 a.m,4.7/28,75,Picture,info@egypttrips.com,+20 123 456 789,"towel,suncream, Cash, Walking shose",Easy,"English, French, German, Arabic, Russian., Polish,",2-70 Year Old,"Bus, Van, Boat","Lunch, Snacks",Free cancellation within 24 hours,Wheelchair accessible,10% off for groups of 4 or more,Every Day
TRIP062,Luxor,Explore the East Bank of Luxor: Top Attractions & Highlights Tour,"Embark on an unforgettable journey through Luxor’s rich history! Start by exploring the awe-inspiring Karnak and Luxor Temples, marveling at their grand architecture and profound cultural significance. Continue your adventure with a visit to Mut’s tomb, a site that holds captivating tales of the past, and stand in awe of Ramses II's Obelisk, a towering symbol of ancient splendor. Conclude your half-day tour with a delicious lunch, perfectly rounding out this enriching experience. It’s the perfect way to dive into Luxor’s timeless wonders!","Family, Couples, Indeviduals,Group",4 Hours,45,30,"Transportation, Guide, Entrance Fees, Meals","Drinks, Shoping, Guide Tips,",4/1/2025,1/1/2030,49,John Doe - Licensed Egyptologist,10-20 people,Hotel Lobby,09:00 a.m,04:00 p.m,4.7/29,76,Picture,info@egypttrips.com,+20 123 456 789,"towel,suncream, Cash, Walking shose",Easy,"English, French, German, Arabic, Russian., Polish,",2-70 Year Old,"Bus, Van, Boat","Lunch, Snacks",Free cancellation within 24 hours,Wheelchair accessible,10% off for groups of 4 or more,Every Day
TRIP063,Luxor,Cairo Day Tour from Luxor by Flight: Discover Egypt’s Highlights.,"Embark on a journey through the heart of Egypt’s glorious past, starting in Luxor and culminating in Cairo! Witness the awe-inspiring grandeur of the Pyramids of Giza and the enigmatic Sphinx, timeless symbols of human achievement. Explore the treasures of Cairo’s museums, home to artifacts that narrate the fascinating tales of ancient Egypt.

Dive deeper into history with visits to captivating Coptic and Islamic sites, each reflecting the rich cultural and spiritual heritage of this magnificent land. From ancient wonders to vibrant traditions, this timeless adventure promises an unforgettable experience filled with discovery and inspiration!","Family, Couples, Indeviduals,Group",16 Hours,295,270,"Transportation, Guide, Entrance Fees, Meals","Drinks, Shoping, Guide Tips,",4/1/2025,1/1/2030,50,John Doe - Licensed Egyptologist,10-20 people,Hotel Lobby,04:00 a.m,09:00 p.m,4.7/30,77,Picture,info@egypttrips.com,+20 123 456 789,"towel,suncream, Cash, Walking shose",Moderate,"English, French, German, Arabic, Russian., Polish,",2-70 Year Old,"Bus, Van, Boat","Lunch, Snacks",Free cancellation within 24 hours,Wheelchair accessible,10% off for groups of 4 or more,Every Day
TRIP064,Luxor,Day tour to aswan from luxor,"Set off on an unforgettable day trip from Luxor to Aswan, where history and culture come alive! Begin your adventure at the stunning Philae Temple, dedicated to the goddess Isis, surrounded by the tranquil waters of the Nile. Next, immerse yourself in the vibrant traditions of a Nubian Village, experiencing the warmth and charm of Nubian hospitality.

Continue to the majestic Abu Simbel temples, a breathtaking marvel of ancient engineering and artistry. These colossal monuments, built by Ramses II, stand as timeless symbols of Egypt's grandeur. This journey is a perfect blend of history, culture, and unforgettable experiences, offering a day you’ll treasure forever!","Family, Couples, Indeviduals,Group",12 Hours,140,70,"Transportation, Guide, Entrance Fees, Meals","Drinks, Shoping, Guide Tips,",4/1/2025,1/1/2030,51,John Doe - Licensed Egyptologist,10-20 people,Hotel Lobby,06:30 a.m,08:30 p.m,4.7/31,78,Picture,info@egypttrips.com,+20 123 456 789,"towel,suncream, Cash, Walking shose",Moderate,"English, French, German, Arabic, Russian., Polish,",2-70 Year Old,"Bus, Van, Boat","Lunch, Snacks",Free cancellation within 24 hours,Wheelchair accessible,10% off for groups of 4 or more,Every Day
TRIP065,Luxor,"Visit edfu, kom ombo temples from luxor","Dive into the adventure of a lifetime as you uncover the marvels of Egypt's iconic temples! Start your epic journey at Edfu's majestic Horus Temple, renowned for its exquisite preservation and awe-inspiring carvings dedicated to the falcon god. Then, venture to Kom Ombo, the unique dual temple that honors both Sobek, the crocodile deity, and Horus, the protector of the pharaohs.

Along the way, savor a delightful lunch that complements the historical exploration, making your experience both enriching and satisfying. This journey blends fascinating history, architectural splendor, and culinary delight—a perfect way to celebrate Egypt’s timeless wonders!","Family, Couples, Indeviduals,Group",8 Hours,69,34.5,"Transportation, Guide, Entrance Fees, Meals","Drinks, Shoping, Guide Tips,",4/1/2025,1/1/2030,52,John Doe - Licensed Egyptologist,10-20 people,Hotel Lobby,09:00 a.m,04:00 p.m,4.7/32,79,Picture,info@egypttrips.com,+20 123 456 789,"towel,suncream, Cash, Walking shose",Moderate,"English, French, German, Arabic, Russian., Polish,",2-70 Year Old,"Bus, Van, Boat","Lunch, Snacks",Free cancellation within 24 hours,Wheelchair accessible,10% off for groups of 4 or more,Every Day
TRIP066,Luxor,Transfer from Luxor Airport,"Enjoy a seamless and comfortable transfer from Luxor Airport to your hotel with a professional ride in a modern vehicle. Relax as skilled drivers ensure a smooth journey, allowing you to start your Egyptian adventure stress-free. It's the perfect way to experience convenience and style right from the moment you arrive!","Family, Couples, Indeviduals,Group",Half Day,10,5,"Transportation, Guide, Entrance Fees, Meals","Drinks, Shoping, Guide Tips,",4/1/2025,1/1/2030,20,John Doe - Licensed Egyptologist,10-20 people,Hotel Lobby,24 HRS,24 HRS,4.5/18,89,Picture,info@egypttrips.com,+20 123 456 789,"towel,suncream, Cash, Walking shose",Easy,"English, French, German, Arabic, Russian., Polish,",2-70 Year Old,"Bus, Van, Boat","Lunch, Snacks",Free cancellation within 24 hours,Wheelchair accessible,10% off for groups of 4 or more,Every Day
TRIP067,Hurghada,Cairo By Air,"Embark on an unforgettable day trip to Cairo by plane, where history and culture come alive! After a short flight, marvel at the iconic Pyramids of Giza, one of the Seven Wonders of the World, and the ancient Sphinx, standing as timeless symbols of Egypt's grandeur. Dive into the fascinating history at the Egyptian Museum, home to thousands of priceless artifacts, including the treasures of King Tutankhamun.
Savor authentic Egyptian cuisine before exploring the vibrant Khan El Khalili Bazaar, where you can shop for unique souvenirs and immerse yourself in Cairo's lively atmosphere. With professional guides, hassle-free transfers, and top-notch service, this tour ensures a comfortable and enriching experience.
For the best prices and premium service, book your Cairo day trip by flight from Hurghada online.","Family, Couples, Indeviduals,Group",Half Day,195,185,"Transportation, Guide, Entrance Fees, Meals","Drinks, Shoping, Guide Tips,",4/1/2025,1/1/2030,20,John Doe - Licensed Egyptologist,10-20 people,Hotel Lobby,04:00 a.m,09:00 p.m,4.5/18,89,Picture,info@egypttrips.com,+20 123 456 789,"towel,suncream, Cash, Walking shose",Easy,"English, French, German, Arabic, Russian., Polish,",2-70 Year Old,"Bus, Van, Boat","Lunch, Snacks",Free cancellation within 24 hours,Wheelchair accessible,10% off for groups of 4 or more,Every Day
